{
  "$schema": "https://json-schema.org/draft/2020-12/schema",
  "$id": "https://cheeleong.dev/fitd-system-json/systems/coverage.schema.json",
  "title": "Interval source coverage report",
  "type": "object",
  "properties": {
    "sourceFile": { "type": "string", "minLength": 1 },
    "contentFirstLine": { "type": "integer", "minimum": 1 },
    "contentLines": { "type": "integer", "minimum": 1 },
    "uncoveredLines": { "type": "array", "maxItems": 0 },
    "recordCounts": { "type": "object" },
    "recordsWithLocators": { "type": "integer", "minimum": 1 }
  },
  "required": ["sourceFile", "contentFirstLine", "contentLines", "uncoveredLines", "recordCounts", "recordsWithLocators"],
  "unevaluatedProperties": false
}
